[
  {
    "breach_id": "breach-001",
    "shipment_id": "ship-001",
    "trip_id": "trip-001",
    "vehicle_id": "veh-001",
    "start_timestamp": "2026-10-24T23:15:54Z",
    "end_timestamp": "2026-10-24T23:17:54Z",
    "min_cargo_temp_c": 9.5,
    "max_cargo_temp_c": 10.3,
    "allowed_min_temp_c": 2.0,
    "allowed_max_temp_c": 8.0,
    "duration_minutes": 2.0,
    "severity": "high",
    "resolved_flag": true
  }
]